{
  "schemaVersion": 1,
  "revision": 5,
  "updatedAt": "2026-09-28T00:20:00Z",
  "departments": [
    {
      "id": 990001,
      "name": "Тестовая поликлиника",
      "specialities": [
        {
          "id": 990002,
          "name": "Невролог",
          "doctors": [
            {
              "id": 990003,
              "name": "Тестовый врач",
              "bookingType": "1",
              "slots": [
                { "date": "2030-01-15", "time": "10:30" }
              ]
            }
          ]
        }
      ]
    }
  ]
}
